{
  "$schema": "../../schema/recipe.schema.json",
  "format": 3,
  "slug": "chai-masala",
  "category": "powder",
  "title": "Chai Masala",
  "name": "Chai Masala Powder",
  "subtitle": "A roasted cardamom, clove, pepper and dry ginger blend for masala tea — plus how to brew 2 cups.",
  "badges": [
    "Jain Vegetarian",
    "Toddler-adapted"
  ],
  "labels": [
    "Spice Blend · Tea"
  ],
  "meta": [
    "Prep: 5 min",
    "Roast: 5 min",
    "Yield: 1 box (~1 cup)"
  ],
  "protein": "A pantry blend — ½ tsp flavours 2 cups of chai",
  "nightPrep": null,
  "ingredientGroups": [
    {
      "label": "Whole spices",
      "items": [
        {"id": "cardamom", "name": "Green cardamom", "short": "cardamom", "amount": "40g"},
        {"id": "cloves", "name": "Cloves", "short": "cloves", "amount": "20g"},
        {"id": "pepper", "name": "Black peppercorns", "short": "pepper", "amount": "20g"},
        {"id": "cinnamon", "name": "Cinnamon", "short": "cinnamon", "amount": "8g"},
        {"id": "fennel", "name": "Fennel (saunf)", "short": "fennel", "amount": "10g"}
      ]
    },
    {
      "label": "Warming spices",
      "items": [
        {"id": "dry-ginger", "name": "Dry ginger (sonth)", "short": "dry ginger", "amount": "30g"},
        {"id": "tulsi", "name": "Tulsi seeds", "short": "tulsi seeds", "amount": "6"},
        {"id": "nutmeg", "name": "Nutmeg (jaiphal)", "short": "nutmeg", "amount": "½"}
      ]
    },
    {
      "label": "For 2 cups of chai",
      "items": [
        {"id": "water", "name": "Water", "short": "water", "amount": "2 cups"},
        {"id": "tea", "name": "Tea powder", "short": "tea powder", "amount": "4 tsp"},
        {"id": "chai-masala", "name": "Chai masala, from above", "short": "chai masala", "amount": "½ tsp"},
        {"id": "milk", "name": "Milk", "short": "milk", "amount": "1 cup"},
        {"id": "sugar", "name": "Sugar", "short": "sugar", "amount": "2 tsp"}
      ]
    }
  ],
  "method": [
    {
      "type": "step",
      "title": "Roast",
      "items": [
        "In a heavy-bottomed pan, take {@cardamom}, {@cloves}, {@pepper}, {@cinnamon} and {@fennel}",
        "Dry roast on a low flame until aromatic; keep aside",
        "Break {@dry-ginger} into pieces and dry roast until aromatic; keep aside",
        "Add {@tulsi} and {@nutmeg} to the pan and roast well"
      ]
    },
    {
      "type": "step",
      "title": "Grind and store",
      "items": [
        "Cool everything completely, then transfer all the spices to a blender",
        "Blend to a slightly coarse powder",
        "Let the powder cool before closing the jar — trapped warmth brings moisture",
        "Store in an airtight container; use within a month"
      ]
    },
    {
      "type": "toddler",
      "label": "Toddler note",
      "items": [
        "Chai isn't for her — tea has caffeine, and this masala is peppery",
        "Warm her a cup of milk with a pinch of plain ground cardamom instead"
      ]
    },
    {
      "type": "step",
      "title": "Make 2 cups of chai",
      "items": [
        "In a saucepan, take {@water}, {@tea} and {@chai-masala}",
        "Boil 4 min, until a strong decoction forms",
        "Add {@milk} and {@sugar}; bring the chai to a boil twice",
        "Strain and enjoy"
      ]
    },
    {
      "type": "tip",
      "label": "Tip",
      "text": "Keep the roast low and slow — the spices burn quickly and turn bitter. A coarse grind gives the chai more body than a fine powder. A heavy pan on the stove for the roast, then a dry spice grinder; the chai itself is a saucepan job."
    }
  ],
  "tags": [],
  "added": "2026-10-14"
}
